{
  "schema_version": "1.0",
  "asset": "passport",
  "evidence_type": "recovery_confidence",
  "observed_at": "2030-07-18T12:00:00Z",
  "expires_at": "2030-08-17T12:00:00Z",
  "host_identity": "sanitized-test-host",
  "ivy_revision": "test-revision",
  "policy_reference": "docs/BACKUP_RECOVERY_CONFIDENCE.md",
  "backup_scope": "sanitized fixture scope",
  "verification_method": ["manifest integrity", "bounded restore sample"],
  "result": "VERIFIED",
  "findings": ["Fixture evidence only; not a real Passport observation."],
  "disposition": "No production action; test fixture.",
  "review_owner": "test"
}
