{
  "schema_version": "1.0",
  "asset": "passport",
  "evidence_type": "recovery_confidence",
  "observed_at": "2020-01-01T12:00:00Z",
  "expires_at": "2020-02-01T12:00:00Z",
  "host_identity": "sanitized-test-host",
  "ivy_revision": "test-revision",
  "policy_reference": "docs/BACKUP_RECOVERY_CONFIDENCE.md",
  "backup_scope": "sanitized fixture scope",
  "verification_method": ["manifest integrity"],
  "result": "VERIFIED",
  "findings": ["Fixture evidence only; intentionally expired."],
  "disposition": "Review required; test fixture.",
  "review_owner": "test"
}
